text,score
বাংলাদেশে প্রায় কোটি মানুষ একেকজনের মতামত একেক রকম হবে স্বাভাবিক তাই বলে আমার যা মনে হবে সেটা সঠিক বাকিদের যা মনে হবে তা ভুল এটা কিন্তু নয় ভার্সিটিতে পড়ুয়াদের মনে হয় ন্যাশনাল কিংবা প্রাইভেট ভার্সিটির ছাত্ররা ফার্মের মুরগী দেশের বাহিরে নামিদামি ভার্সিটিতে পড়ুয়াদের মনে হয় বাংলাদেশের বিশ্ববিদ্যালয়ের ছাত্ররা কিছুই পারে না হয়াটা স্বাভাবিক কিন্তু সেটার উপর নির্ভর করে মন্তব্য করাটা বোকামী বড় ব্যবসায়ীর একদিনের রেস্টুরেন্টের বিলের টাকা দিয়ে মধ্যবিত্ত একটা পরিবার মাস খুব সুন্দর ভাবেই কেটে যায় লাখ টাকা দিয়ে একটা পরিবার একমাস চালায় আবার কেউ হাজার টাকায় একটা পরিবার একমাস চালায় রেস্টুরেন্টের ডিনারের বিলের চেয়েও হয়ত গ্রামের নিম্নমধ্যবিত্ত কোন পরিবারের বিয়ের খরচ কম হয় বলে আমি যা করি বলি দেখি দেখাই সেটার উপরে নির্ভর করে সব কিছু যাচাই করা উচিত না,2
বাংলাদেশের কোটি মানুষের কোটি জুতার বাড়ি দিলেও এই মডেল আরিফ খানের যোগ্য সম্মান দেয়া হইবে না,1
বাংলাদেশের মানুষের ভবিষ্যৎ বাণী দেখে হাসি করে এসে ওনার কতটুকু পরিবর্তন হয় তা নয় হজ্ব করে আসার পরই করে না জেনে একটা মানুষকে কিংবা তার পরিবার কে নিয়ে বাজে মন্তব্য করা এবার বন্ধ করেন যাতে সাকিব ভাইয়া সহ ওনার পুরো পরিবার আর সকল হজ্ব যাত্রী হজ্ব ঠিকভাবে পালন করে সুস্থ ভাবে ফিরে আসতে পারে,2
বাংলাদেশের সানি আকর্ষনীয় ভেরী,1
বাংলাদেশের সানিলিওয়ান,1
বাংলার,2
বাংলার জনি সিন্স তোমার ক্রিকেট ক্যারিয়ারটাই যাইবো ঐসবের কাজের জন্যে আজ জাতীয় দল প্লেনে আর তুমি রাস্তার বাইকে তুমি বাইকে উঠে হেলমেট না পড়লেও চলবে কিন্তু নিচেরটাই অবশ্যই হেলমেট পড়বে,1
বাংলার মাগির বাচ্চা মাগি,1
বাংলার সানি লিওন,1
বাংলার সানি লিওন হিসাবে খুজে পেয়েছে,1
বাইঞ্চুদ তরে দেখলে মন চায় মুতের ট্যাঙ্কিতে হালাইয়া আধাঘন্টা সাঁতার জানি না বইলা বাইচ্চা গেলি ইচ্ছা ছিল তরে গালিতে গালিতে সুদে দেব কিন্তু ভাবসি ভালো হইয়া যামু তাই তুই বাইচা গেলি খানকির সেলে ম্রে পত্তিসুদ,1
বালি নাই তো কি হইছে তলাতে তো বাল আছে দাদা মদ খা,1
বাসায় আটা ময়দা সুজি এতো কম ছিলো যে মুখে এতো কম লাগাইছেন,1
বাহ অমাইক ফিগার,1
বাহ্ এ লুকিংটা দারুণ,1
বিউটি ফুল,2
বিউটি ফুল আপু,1
বিজ্ঞাপন দিলেন,2
বিদয়,1
বিবাহিত স্বামী বিদেশ স্বামী নেই অথবা স্বামীর কাছ থেকে পরিপূর্ণ শারীরিক চাহিদা মেটাতে পারছেন না এই রকম যে কোন বয়সের মহিলা আন্টি ভাবি আপু গোপনে শারীরিক চাহিদা মেটাতে চাইলে আমার সাথে মেটাতে পার আমি তোমাকে কথা দিচ্ছি এই গোপন বিষয়টা তুমি আর আমি ছাড়া আর কেউ জানবে না আমাকে বিশ্বাস করতে পার করতে চাইলে আমাকে,1
বিরোধিতার প্রশ্নে আর বিরোধিতা নয় দেশকে যদি ভালোবেসে থাকি তাহলে উন্নয়ন আর অগ্রগতি হতে হবে মূল বিবেচ্য বিষয়,2
বিশ্বসেরা অলরাউন্ডারের পেইজ থেকে সর্বকালের সেরা,2
বুড়ী গাই এর মত কিন্তুু তারিকের পিকটা সেই রকম ছিলো,1
বেবি,1
বেবি ডল আসিতেছে,2
বেশি কিছু বলবো না আগামী মিনিটের মধ্যে পপুলার মেডিক্যালে এসে একবার পরিদর্শন এ আসুন এমনিতেই অনেক সম্মান আছে আপনার এ রকম বেকুবের মতো পোস্ট দিয়ে জনগণরে ক্ষেপাইন না বাংলাদেশের পাবলিক যদি উন্নত দেশের মতো হতো আপনাদের কয়েকটা মন্ত্রীকে এতদিন রাস্তায় নামিয়ে পিটাতো ভাগ্য ভালো তেমন কিছু করে নি এখনো সময় আছে আর সামনে নির্বাচনও আছে আর কলেজ স্টুডেন্টরা বয়স ভোট ব্যাংক বাচান,2
বৈঠাওয়ালা,2
বোনের এক ভাই,1
ব্যপক,2
ভাই,2
ভাই আপনাকে অনেক ভালো লাগে জানি না আপনি কেমন তবে আমার কাছে মনে হয় আপনি অনেক ভালো এতে গালাগালির মাঝে চুপচাপ থাকেন যে কেউ থাকতে পারবে না আমি আপনাকে ফলো করি বছর যাবৎ কোনো দিন কমেন্ট করি নাই আজ কমেন্ট না করে থাকতে পারি নাই আপনার কাজ আপনি করে যান কি বলল এই গুলায় কান দিয়েন না ব্যাবহার বংশের পরিচয়,1
ভাই আপনার জানের অবস্থা,2
ভাই আপনারা কি শুরু করলেন অরে একটু ভদ্র ভাষায় কথা বলেন যেমন আরিফ একটা নটির পুলা আরিফফার পাছার বম্বে মরিচ ঢুকাইয়া সেফাত দাদার মদের বুতল জুলাই রাখনের দরকার খানকি একটা শালা মাগি,1
ভাই ঠিক আসে রমজান মোবারক দোহাই লাগে এই মাস এ এমন ছবি পোস্ট করিএন না যেইটা দেখে আমাদের রোজা অ ভেশতে যায়,1
ভাই তোদের ডাক্তার,2
ভাই ধাক্কা দিয়েন না তো লাইনে দাড়ান বিনোদন পাবেন স্টক আনলিমিটেড,1
ভাই বোটে সিংগেল যাওয়ার সুযোগ থাকলে ভাড়া,2
ভাই শোনেন এই দেশে মতিয়া চৌধুরীর মত একজন সৎ কর্মঠ ও নির্ভীক মানুষ পাওয়া যায় না কৃষিতে ওনার অবদান দেখেন আপনাদের বয়স কম তাই বুঝতে পারেন না উনি মুক্তিযোদ্ধা দেশের জন্য অনেক অবদান আমি রাজাকার লেখা টি শার্ট গায়ে দেয়া কোন যুক্তিতেই গ্রহণযোগ্য নয়,2
ভাই শোনেন এই দেশে মতিয়া চৌধুরীর মত একজন সৎ কর্মঠ ও নির্ভীক মানুষ পাওয়া যায় না কৃষিতে ওনার অবদান দেখেন আপনাদের বয়স কম তাই বুঝতে পারেন না উনি মুক্তিযোদ্ধা দেশের জন্য অনেক অবদান আমি রাজাকার লেখা টি শার্ট গায়ে দেয়া কোন যুক্তিতেই গ্রহণযোগ্য নয়,2
ভাই সবগুলো পর্ব পড়তে চাই,2
ভাইরাল হছ্ছে না,0
ভাইরে তরে ধন্যবাদ অনেক দিন পরে তরে দেইখা একটু হাসতে পারলাম,1
ভাইয়া,2
ভাইয়া আসসালামু আলাইকুম চিটাগং থেকে বলছি আমি আইটি নিয়ে বিজনেস করি প্রযুক্তি আমার রক্তের সাথে মিশে গেছে আর এই প্রযুক্তি কে আরও ছড়াতে আমি আউটলেট দিয়েছি সব চাইতে ব্যস্ততম জাইগায় যে খানে প্রযুক্তি কে সবাইর সামনে উপ্সথাপন করতে পারবো আপনি অনেক মুল্যবান একজন ব্যক্তি আমাদের বাংলাদেশ এর জন্য আপনি আমাদের গৌরব আমি আপনার একজন ভক্ত বলতে পারেন নিরবে আপনাকে ভালোবাসি আর আপনার নিতি নৈতিকতা কে অনুসরন করার চেস্টা করি খুবই ইচ্ছা আপনাকে সামনে দেখার জানি এই ইচ্ছা পূরন হবে না অনেক সাধনা আর অনেকের মাধ্যমে যেতে হবে আপনার সান্নিধ্য কিন্তু একটা শেষ ইচ্ছা হলো জানি না পূরন হবে কি আমার এই ছোট প্রুযুক্তির ঘর টা যদি আপনার পবিত্র হাত দিয়ে উদ্ভোধন করতে পারতাম আমি এই খুদে মানুষটার জীবন টার জীবনের পাওয়া হয়ে যেত আপনার উপস্থিতি আমাকে অনুপ্রাণিত করবে জননেত্রি শেখ হাসিনার ডিজিটাল বাংলাদেশ গড়ার প্রত্যয় আমাদের চেস্টা চলছে চলতে থাকবে ইনশাআল্লাহ,2
ভাউ এইডা কি সেই সেই হট,1
ভাল,2
ভাল কাপড় কিনলে কি হয় নাকি টাকা,1
ভালা হইত,1
ভালোবাসা জানবেন স্যার একজন মুক্তিযোদ্ধার সন্তান হিসেবে সবচে বেশী কষ্ট পেয়েছি জীবনে এই অমানুষদের রাজাকার শব্দটি বুকে পিঠে ব্যানারে ধারন করতে দেখে পরিচয়ের দেউলিয়াত্ব ঠিক কোথায় গিয়ে ঠেকেছে আর বাঙ্গালিয়ানার গৌরব কোথায় পৌঁছেছে ভাবলেও কষ্ট হয় আন্দোলনের মধ্য দিয়ে মুক্তিযুদ্ধ মুক্তিযোদ্ধা এবং তাদের পরিবারদের অপমান করার একটা সুযোগ তৈরি করে দেয়া হয়েছে তৈরি করে দেয়া হয়েছে গর্বভরে নিজেকে রাজাকার ডাকার এরা এমনি এমনি এই কাজটি করেনি মনের মধ্যে থাকা অনেকদিনের উদগ্র বাসনা উগড়ে দিয়েছে আমি বিশ্বাস করিনা এসব পরিকল্পনা ছাড়াই হয়েছে মুক্তিযোদ্ধার সন্তানরা আর গর্ব করে কথাটা বলতে পারেনা তাদের লজ্জায় পরিচয় লুকোতে হয় এটাই কোটা আন্দোলনের একমাত্র হয়ত,2
ভালোবাসা জানবেন স্যার একজন মুক্তিযোদ্ধার সন্তান হিসেবে সবচে বেশী কষ্ট পেয়েছি জীবনে এই অমানুষদের রাজাকার শব্দটি বুকে পিঠে ব্যানারে ধারন করতে দেখে পরিচয়ের দেউলিয়াত্ব ঠিক কোথায় গিয়ে ঠেকেছে আর বাঙ্গালিয়ানার গৌরব কোথায় পৌঁছেছে ভাবলেও কষ্ট হয় আন্দোলনের মধ্য দিয়ে মুক্তিযুদ্ধ মুক্তিযোদ্ধা এবং তাদের পরিবারদের অপমান করার একটা সুযোগ তৈরি করে দেয়া হয়েছে তৈরি করে দেয়া হয়েছে গর্বভরে নিজেকে রাজাকার ডাকার এরা এমনি এমনি এই কাজটি করেনি মনের মধ্যে থাকা অনেকদিনের উদগ্র বাসনা উগড়ে দিয়েছে আমি বিশ্বাস করিনা এসব পরিকল্পনা ছাড়াই হয়েছে মুক্তিযোদ্ধার সন্তানরা আর গর্ব করে কথাটা বলতে পারেনা তাদের লজ্জায় পরিচয় লুকোতে হয় এটাই কোটা আন্দোলনের একমাত্র হয়ত,2
ভালোবাসা দিলে,1
ভালোবাসার ফুল তুমি,2
মজা,1
মঠেলিং বাদ দিয়া এদের নিয়া ব্যাবসা ধরলি কবে,1
মদ খা,1
মদ খা খানকির পোলা মদ না খাইলে তুই শব্দ বোমা নিক্ষেপ করতে পারবিনা মদ খা তরজন্য মদ সৃষ্ঠি তুই খাবি তর বাপ খাবি,1
মদ খা শালির ঘরের শালি মদ খা মদ না খেলে তোদের মাথা ঠিক থাকেনা,1
মদ খা হলার পো মদ না খাইলে তুই মানুষ হইবিনা,1
মদ খাইছোর নাকি,1
মধ্য রাতের খাবার,1
মন গুলা পড় পড়েই তোমার মন ভাল হওয়ার,1
মন নিলা যে,2
মন নিলা যে,2
মন মেজাজ খুব খারাপ স্যার কলরেট বাড়ানোর কারন তো গাছে ধরে না তাই যা ইচ্ছা তাইই করছেন মিনিটরেট নেটরেট সবই বাংলাদেশে কি দাম না,2
মন সুফিয়ানা,2
মনটা খারাপ কমেন্ট পড়তে আসলাম,1
মনির হোসাইন,2
মনির হোসেন রাজু,2
মনে আছে যেইদিন রুপসা ব্রিজ ওপেন হয়,2
মন্তব্য নিজের খেয়ে বনের মোষ তাড়ানোর কি দরকার আপনার এতো জিওগ্রাফি চ্যানেল আমি একটু বেশি দেখি,2
মফিজ,1
মরি যা বে হালার হালা অত মানুষ মরে তোর মরণ নাই ফুরিন দেখলেই ল্যাটাল্যাটি করা,1
মহিন বাপ্পি খুরশিদ অনিম রুবেল নির্ঝর আহমেদ মোহাম্মদ ফারুক দেখেন চুদানিপুতের অবস্থা,1
মাংগের স্টাইল হালার,1
মাগি তোর বোদায় বাশ দিবে আশতেছে তুই মিথ্যা গুজব ছড়াইছত আসতেছে পুলিশ,1
মাগি শেষ মেস খুলে ফেললো,1
মাগির ছেলে তুই কবে মানুষ হবি,1
মাগির পোলা সারারাত মদ খেয়ে লেসবূ পিক আপ্লোড করতে আসছে সবাই মাদারীকে দুচে দিন,1
মাগিরপোলারে দেখে হাসতে হাসতে বিচি ফুসফুস এ উঠে আটকায়া,1
মাগীর পোলা তোরে ট্রাস ট্রাস করে সুদে,1
মাথার সামনে হাগু করেচে কে,1
মাদারচুত আর সময় পাইলি না পোস্ট দেওয়ার লেবু তর নুনুর চিদ্র দিয়া ডুকা,1
মাদারচোদ,1
মাদারচোদ তোর বাপ যেই লাল কনডম পইড়া লাগাইসিল ওই কনডম টাই বড় হইয়া তুই হইসস,1
মাদারজাদ মুছ গুলাতে যদি অক্টেন মাইরা আগুন লাগাই দিতে,1
মাদারদোচা তোরে আইজকা গাইল্লামু না কজ টুডে জুমাবার টাইম এসব হোগামারা ফডু দিয়া মাইনষের হাগু বারাইস না কইলাম আবালচোদা,1
মাননীয় অসাধারণ জনগন,2
মান্দার পো মান্দা এম ই এস এর সামনে তিন চারটা চোক্কা বিশাল স্টিলের টাওয়ার পুলাপাইন খেপলে কিন্তু দুই পায়ে দুই টনের দুইডা বস্তা বাইন্দা পুটকির রঙন রিদ্দ থুক্কু ছিদ্র বরাবর টাওয়ারে ফিট কইরা বসায়া দিবো তাইলে ক্যাত কইরা হান্দায়া যাইবো বান্দির দ্যা ওয়ে তাবিজ্জা মাদার্চুদে কি বিড়ি খাইয়া বিড়ির সোকা তর গোয়ায় না ফালায়া কি তর মাথায় আহারে চুল গুলা পুইড়া গেছে,1
মামা তুই ইন্ডিয়া চলে তারা লেসবুদের এলাউ এখানে আর ডলাডলি চুদানোর পিক আপ্লোড করিসন মাইয়া মাইয়ার ডলাডলি দেখতে ভালো,1
মামা হাল্কা পড়িস কইলাম,1
মামা হুমায়ুন কবীর,2
মাল,1
মাল তো আউট,1
মালটু কেপালেক জেন,1
মাশা লাগছে আমাদের জন্য একটু দোয়া করবেন হয়ত হাজার কমেন্টের মাঝে এই কমেন্ট আপনার কাছে না ও পৌঁছাতে পারে তারপরও বলছি দোয়া চাই,2
মিয়া আপা,1
মিয়া খলিফার কপি,1
মিয়া খলিফার মতো লাগছে,1
মেঘ কাব্য আরিফ,1
মেডিকেল সার্টিফিকেট দেখাতে পারলে কাজ হবে,2
মেসি গোল করার পর যেই আনন্দটা লাগে তার থেকে বেশি আনন্দ লেগেছে কাতারের বিরুদ্ধে জামাল ভুইয়ার মিনিটে করা লিগ বা দেশ নিয়ে কতো দেন আজকের এই আনন্দের রাতে বাংলাদেশের ফুটবলার দের নিয়ে এ ভরিয়ে,2
মেয়েরা তোমরা গাড়ির টিউব আমরা গাড়ির টায়ার,1
যতদিন উন্নয়নের নেত্রী দেশরত্ন শেখ হাসিনা হাতে থাকবে দেশ পথ হারাবেনা বাংলাদেশ বাংলা জয় বঙ্গবন্ধু,2
যতদিন রবে পদ্মা মেঘনা গৌরী যমুনা বহমান ততদিন রবে কীর্তি তোমার হে জাতির পিতা বঙ্গবন্ধু শেখ মুজিবুর রহমান,2
যদি এটা দি তাহলে কি দিবা,1
যদি মিথ্যে কথা বলে প্রেসনোট দেয় তবে সে সরকারের উপর মানুষের বিশ্বাস থাকতে পারে না শেখ মুজিবুর রহমান রোজনামচা,2
যাই করছে পরিশ্রম করে তো চুরি করে তো আর খাচ্ছে না রেস্পেক্ট,2
যাহা লাগছে না,1
যে আপনাকে কষ্ট দিয়েছে থাকে শুধু গালি দেন অন্য কাউকে না ঠিক আছে,1
যে দেশে বঙ্গবন্ধুর মত আদর্শবান ও গুনি ব্যক্তিদের নির্মমভাবে স্বার্থের কারণে হত্যা করা হয় সেদেশে জাতী কি আশা করতে,2
যেকোনো বয়সের করে ভোদার জ্বালা মিটাতে চাইলে আমাকে এড দাও অথবা নক,1
রাতে নেংট্যা দিনে শয়তানের খাড়া ঝিলকি,1
রাতের,2
রাফি রাফি,2
রুচিবোধের তারিফ করতে হয়,2
রুমে শুয়ে স্ক্রল করতেছিলাম হটাৎ শাউয়াডার খোমা দেইখা কইয়া এমন জোড়ে চিল্লান দিয়া উঠছি পাশের ফ্ল্যাটের মানুষ চলে আসছে আর সাথে সাথে আবিষ্কার করলাম রাগের সোদনে কুতনের চোটে পাছা দিয়া গু বাইর হইয়া গেছে শাউয়াডা বাল আমার,1
রেডি,2
রেপ,1
লম্বা খোলা চুলে তুমাকে খুব সেক্সি,1
লাইটিং মারাত্নক এসেছে,2
লাগছে,2
